{
  "id": "sunset",
  "clients": ["1.45.0.0"],
  "base": { "space": "spaces/h08_mt_hangar", "environment": "h08_mt_hangar_Autumn_TD2" },
  "probes": true,
  "sky": { "deferred": "maps/skyboxes/Photometric_sky/minsk_june_clear_sunset_rgbe.dds" },
  "set": [
    { "path": "day_night_cycle/starttime", "value": 18.6 },
    { "path": "day_night_cycle/deferred/angle", "value": 9 },
    { "path": "day_night_cycle/deferred/angleZ", "value": 285 },
    { "path": "day_night_cycle/forward/angle", "value": 12 },
    { "path": "day_night_cycle/sunColor", "value": [255, 150, 80] },
    { "path": "day_night_cycle/sunLightColor", "value": [1, 0.55, 0.3] },
    { "path": "day_night_cycle/sunLightColorForward", "value": [1, 0.62, 0.4] },
    { "path": "day_night_cycle/ambientColorForward", "value": [0.85, 0.72, 0.7] },
    { "path": "HDR/environment/sunlightLumMultiplier", "value": 60 },
    { "path": "HDR/environment/ambientLumMultiplier", "value": 0.8 },
    { "path": "HDR/environment/sunDiskLumMultiplier", "value": 140 },
    { "path": "HDR/bloom/threshold", "value": 0.05 },
    { "path": "HDR/bloom/amount", "value": 0.55 },
    { "path": "HDR/bloom/tint", "value": [1, 0.75, 0.55] },
    { "path": "HDR/colorCorrection/map", "value": "system/maps/post_processing/cube/otmetki/sunset.dds" },
    { "path": "Fog/deferred/color", "value": [0.95, 0.62, 0.42, 4] },
    { "path": "Fog/deferred/scatterColor", "value": [1, 0.6, 0.32, 3.5] },
    { "path": "Fog/forward/color", "value": [0.95, 0.7, 0.5, 5] },
    { "path": "GodRays/enable", "value": true },
    { "path": "GodRays/color", "value": [1, 0.62, 0.38, 14] }
  ]
}
