{
  "id": "night",
  "clients": ["1.45.0.0"],
  "base": { "space": "spaces/h08_mt_hangar", "environment": "h08_mt_hangar_Autumn_TD2" },
  "probes": true,
  "sky": {
    "deferred": "maps/skyboxes/h33_comp7_sky/skydome/h33_comp7_sky_rgbm.dds",
    "forward": "maps/skyboxes/h33_comp7_sky/skydome/h33_comp7_sky_forward.dds"
  },
  "set": [
    { "path": "day_night_cycle/starttime", "value": 23.5 },
    { "path": "day_night_cycle/deferred/angle", "value": 34 },
    { "path": "day_night_cycle/deferred/angleZ", "value": 210 },
    { "path": "day_night_cycle/forward/angle", "value": 40 },
    { "path": "day_night_cycle/isMoon", "value": true },
    { "path": "day_night_cycle/drawSunAndMoon", "value": true },
    { "path": "day_night_cycle/sunScale", "value": 1 },
    { "path": "day_night_cycle/sunColor", "value": [200, 215, 255] },
    { "path": "day_night_cycle/sunLightColor", "value": [0.42, 0.52, 0.74] },
    { "path": "day_night_cycle/sunLightColorForward", "value": [0.5, 0.6, 0.82] },
    { "path": "day_night_cycle/ambientColorForward", "value": [0.32, 0.38, 0.52] },
    { "path": "HDR/environment/sunlightLumMultiplier", "value": 14 },
    { "path": "HDR/environment/ambientLumMultiplier", "value": 0.35 },
    { "path": "HDR/environment/sunDiskLumMultiplier", "value": 20 },
    { "path": "HDR/environment/skyExpositionOffset", "value": -2.5 },
    { "path": "HDR/bloom/threshold", "value": 0.1 },
    { "path": "HDR/bloom/amount", "value": 0.5 },
    { "path": "HDR/bloom/tint", "value": [0.7, 0.8, 1] },
    { "path": "HDR/colorCorrection/map", "value": "system/maps/post_processing/cube/otmetki/night.dds" },
    { "path": "Fog/deferred/color", "value": [0.12, 0.16, 0.26, 2] },
    { "path": "Fog/deferred/scatterColor", "value": [0.3, 0.38, 0.6, 1] },
    { "path": "Fog/forward/color", "value": [0.2, 0.26, 0.4, 3] },
    { "path": "GodRays/enable", "value": false },
    { "path": "LensFlare/enable", "value": false },
    { "path": "cloudsShadow/enabled", "value": false }
  ]
}
